id,bussinessid,rating,user,text,time_created,url
yU0NFNqU_Xd322GTq-WE-w,EFM5tk2FyVjY_W43jxfrYQ,3.0,"{'id': 'I3ScxfzbbVVz3MUvsjmItg', 'profile_url': 'https://www.yelp.com/user_details?userid=I3ScxfzbbVVz3MUvsjmItg', 'image_url': 'https://s3-media4.fl.yelpcdn.com/photo/exaBfxoiS4cMrFxC83nRLg/o.jpg', 'name': 'Cristian P.'}",Excelentes tacos y tortas.  El pastor de estés local es excelente así como las salsas. La oferta de tacos no es muy extensa pero todos son excelentes....,2016-10-08 23:15:36,https://www.yelp.com/biz/el-vilsito-ciudad-de-m%C3%A9xico?adjust_creative=xDKeFNUg3YH3P2W3fl1X6g&hrid=yU0NFNqU_Xd322GTq-WE-w&utm_campaign=yelp_api_v3&utm_medium=api_v3_business_reviews&utm_source=xDKeFNUg3YH3P2W3fl1X6g
YjbNMP8khknOAZzB2OSWjQ,EFM5tk2FyVjY_W43jxfrYQ,5.0,"{'id': 'xlAjdF2nbCNUfwf1SDb9hg', 'profile_url': 'https://www.yelp.com/user_details?userid=xlAjdF2nbCNUfwf1SDb9hg', 'image_url': 'https://s3-media2.fl.yelpcdn.com/photo/hh3hMbcMP-0KN0m2N6sGxg/o.jpg', 'name': 'Carolina J.'}",Llegamos aquí gracias a Yelp y al perenne tráfico citadino. El mareado y yo salimos del cine a las 9 de la noche y nos dirigíamos a casa de mis suegros para...,2014-07-01 08:04:27,https://www.yelp.com/biz/el-vilsito-ciudad-de-m%C3%A9xico?adjust_creative=xDKeFNUg3YH3P2W3fl1X6g&hrid=YjbNMP8khknOAZzB2OSWjQ&utm_campaign=yelp_api_v3&utm_medium=api_v3_business_reviews&utm_source=xDKeFNUg3YH3P2W3fl1X6g
RP6bfSPhjasZWbrruJD0cw,EFM5tk2FyVjY_W43jxfrYQ,4.0,"{'id': 'PZNm30z1O959CMLU6lFbMw', 'profile_url': 'https://www.yelp.com/user_details?userid=PZNm30z1O959CMLU6lFbMw', 'image_url': 'https://s3-media1.fl.yelpcdn.com/photo/rl8npMxanO1NUqswNF_czg/o.jpg', 'name': 'Javi A.'}","No pueden faltar si andas por el rumbo y vienes de una noche de fiesta! 
La gringa es de lo mejor y el agua de horchata tmb es muy buena! 
El servicio es...",2016-08-15 13:44:26,https://www.yelp.com/biz/el-vilsito-ciudad-de-m%C3%A9xico?adjust_creative=xDKeFNUg3YH3P2W3fl1X6g&hrid=RP6bfSPhjasZWbrruJD0cw&utm_campaign=yelp_api_v3&utm_medium=api_v3_business_reviews&utm_source=xDKeFNUg3YH3P2W3fl1X6g
CMZR0bx6q-3VjSV4hY5BVQ,9Q9Z5Gnkr15nIvokMPxTgg,4.0,"{'id': '4JDRPTe1HCrADoH7x5GrgA', 'profile_url': 'https://www.yelp.com/user_details?userid=4JDRPTe1HCrADoH7x5GrgA', 'image_url': 'https://s3-media1.fl.yelpcdn.com/photo/cCLCpwIIhVbv0HSAJP1WZA/o.jpg', 'name': 'Norma M.'}","Cuando éramos chamacos ¿a cuántos nos habrá preocupado beber agua directamente de la manguera del jardín? Cloro, sodio y otros minerales eran lo de menos si...",2014-03-08 07:42:07,https://www.yelp.com/biz/agua-purificada-layf-m%C3%A9xico?adjust_creative=xDKeFNUg3YH3P2W3fl1X6g&hrid=CMZR0bx6q-3VjSV4hY5BVQ&utm_campaign=yelp_api_v3&utm_medium=api_v3_business_reviews&utm_source=xDKeFNUg3YH3P2W3fl1X6g
WP5bZoX3upnQXk63cstvsw,jyBGBXB4QgV0nigbNiZftA,3.0,"{'id': 'rmZSDLPL_3gbn8vmbIOXJQ', 'profile_url': 'https://www.yelp.com/user_details?userid=rmZSDLPL_3gbn8vmbIOXJQ', 'image_url': None, 'name': 'Maria Dolores F.'}","La sopa de lentejas es deliciosa. 
La col y papas alemanas son buenas elecciones como guarnición. 
La parrillada puede mejorar. 
Gran opción ir cuando las...",2019-09-14 17:31:38,https://www.yelp.com/biz/nibelungengarten-m%C3%A9xico-2?adjust_creative=xDKeFNUg3YH3P2W3fl1X6g&hrid=WP5bZoX3upnQXk63cstvsw&utm_campaign=yelp_api_v3&utm_medium=api_v3_business_reviews&utm_source=xDKeFNUg3YH3P2W3fl1X6g
j2klNp2q79Xk5YejGkAz2g,jyBGBXB4QgV0nigbNiZftA,3.0,"{'id': 'GAqZkGtihRNYPlG8TLWq9g', 'profile_url': 'https://www.yelp.com/user_details?userid=GAqZkGtihRNYPlG8TLWq9g', 'image_url': 'https://s3-media1.fl.yelpcdn.com/photo/aRAD1TJMiDS-U5t5E8Eyog/o.jpg', 'name': 'Julio A.'}","Llegué al lugar para alcanzar a unos amigos que ya comían acá, el concepto del lugar muy bueno, la calidad de los platillos que probé igual, la cerveza de...",2016-09-07 12:56:50,https://www.yelp.com/biz/nibelungengarten-m%C3%A9xico-2?adjust_creative=xDKeFNUg3YH3P2W3fl1X6g&hrid=j2klNp2q79Xk5YejGkAz2g&utm_campaign=yelp_api_v3&utm_medium=api_v3_business_reviews&utm_source=xDKeFNUg3YH3P2W3fl1X6g
P8sonC6w7hOLj1S5sNSeRg,jyBGBXB4QgV0nigbNiZftA,4.0,"{'id': '5HG6OjSxElvGOzGcp8c8Eg', 'profile_url': 'https://www.yelp.com/user_details?userid=5HG6OjSxElvGOzGcp8c8Eg', 'image_url': 'https://s3-media2.fl.yelpcdn.com/photo/ZOerCGYkWzyiW67WFROggA/o.jpg', 'name': 'Claudio C.'}","Un muy buen lugar para pasar el rato con los amigos o con la familia. Venden cerveza importada y nacional (la famosa DAB, Tucher, etc).
Sus platillos son...",2015-02-13 12:08:15,https://www.yelp.com/biz/nibelungengarten-m%C3%A9xico-2?adjust_creative=xDKeFNUg3YH3P2W3fl1X6g&hrid=P8sonC6w7hOLj1S5sNSeRg&utm_campaign=yelp_api_v3&utm_medium=api_v3_business_reviews&utm_source=xDKeFNUg3YH3P2W3fl1X6g
3ijib8n2jRh9G4osd_Pl1Q,AuYebyA7CbRXkvtHP4FXMQ,2.0,"{'id': 'NSxA3I-Rc9kX5_XYkVo1Aw', 'profile_url': 'https://www.yelp.com/user_details?userid=NSxA3I-Rc9kX5_XYkVo1Aw', 'image_url': 'https://s3-media3.fl.yelpcdn.com/photo/5Rwe1J14lX-cNAdrfjEsww/o.jpg', 'name': 'Jazmín M.'}","#FoodPoliceNoRecomienda // la terraza está linda, sobre la popular y camina le acera de Cumbres de Maltrata. El ambiente bien: parsimonioso, de vecinos....",2016-08-15 13:06:53,https://www.yelp.com/biz/casquet-m%C3%A9xico?adjust_creative=xDKeFNUg3YH3P2W3fl1X6g&hrid=3ijib8n2jRh9G4osd_Pl1Q&utm_campaign=yelp_api_v3&utm_medium=api_v3_business_reviews&utm_source=xDKeFNUg3YH3P2W3fl1X6g
wueIqkACkMjoPkSAZdsffQ,AuYebyA7CbRXkvtHP4FXMQ,5.0,"{'id': 'I3ScxfzbbVVz3MUvsjmItg', 'profile_url': 'https://www.yelp.com/user_details?userid=I3ScxfzbbVVz3MUvsjmItg', 'image_url': 'https://s3-media4.fl.yelpcdn.com/photo/exaBfxoiS4cMrFxC83nRLg/o.jpg', 'name': 'Cristian P.'}",Lugar muy agradable y servicio muy atento. La carta no es muy amplia pero no necesita serlo. La especialidad son las empanadas y son muy buenas a muy buen...,2016-09-09 21:13:41,https://www.yelp.com/biz/casquet-m%C3%A9xico?adjust_creative=xDKeFNUg3YH3P2W3fl1X6g&hrid=wueIqkACkMjoPkSAZdsffQ&utm_campaign=yelp_api_v3&utm_medium=api_v3_business_reviews&utm_source=xDKeFNUg3YH3P2W3fl1X6g
4nbGSs_57dMZBHaXJU53MQ,AuYebyA7CbRXkvtHP4FXMQ,4.0,"{'id': 'zp4Q73nruT-A5EBmGDWiiw', 'profile_url': 'https://www.yelp.com/user_details?userid=zp4Q73nruT-A5EBmGDWiiw', 'image_url': 'https://s3-media2.fl.yelpcdn.com/photo/Gwy54lINC8n09zNUr-zcSw/o.jpg', 'name': 'Alberto F.'}","Nuevo lugar de empanadas argentinas en la zona, muy buena presentación y precios, propuestas de bebida con mate, pidan la Casquet Clásica y la De Pino",2014-09-09 14:39:06,https://www.yelp.com/biz/casquet-m%C3%A9xico?adjust_creative=xDKeFNUg3YH3P2W3fl1X6g&hrid=4nbGSs_57dMZBHaXJU53MQ&utm_campaign=yelp_api_v3&utm_medium=api_v3_business_reviews&utm_source=xDKeFNUg3YH3P2W3fl1X6g
5_aKneoeud9V75NeTNh3pA,MLf4k9S4A0MqouGDr9f69w,5.0,"{'id': '8z8SVZNhP9x17Pwv5aQKmA', 'profile_url': 'https://www.yelp.com/user_details?userid=8z8SVZNhP9x17Pwv5aQKmA', 'image_url': 'https://s3-media3.fl.yelpcdn.com/photo/AHsDfUb3xovPeAR0yu-qlQ/o.jpg', 'name': 'Huitzilihuitl C.'}","Se trata de un lugar fabuloso. Sencillo y casero, bien podría ser el cuarto o cochera de un buen amigo o de uno mismo. Un lugar donde el detalle del sabor...",2014-01-19 21:31:19,https://www.yelp.com/biz/beer-bros-m%C3%A9xico?adjust_creative=xDKeFNUg3YH3P2W3fl1X6g&hrid=5_aKneoeud9V75NeTNh3pA&utm_campaign=yelp_api_v3&utm_medium=api_v3_business_reviews&utm_source=xDKeFNUg3YH3P2W3fl1X6g
6ifDysi6jqKUblXMMXFIbw,MLf4k9S4A0MqouGDr9f69w,4.0,"{'id': 'w93I6aXevBcxo_HYL-4PLA', 'profile_url': 'https://www.yelp.com/user_details?userid=w93I6aXevBcxo_HYL-4PLA', 'image_url': 'https://s3-media3.fl.yelpcdn.com/photo/1W4-jKfDT7Pn-F7dgXfVYw/o.jpg', 'name': 'David O.'}","Beber cerveza es toda una materia. Fermentación, maltas, trigos, temperaturas, vasos, inclinación correcta... en fin, un arte que requiere de paciencia y...",2014-01-19 20:50:49,https://www.yelp.com/biz/beer-bros-m%C3%A9xico?adjust_creative=xDKeFNUg3YH3P2W3fl1X6g&hrid=6ifDysi6jqKUblXMMXFIbw&utm_campaign=yelp_api_v3&utm_medium=api_v3_business_reviews&utm_source=xDKeFNUg3YH3P2W3fl1X6g
Y0tVs8oqbjkX8SOn1UtGog,MLf4k9S4A0MqouGDr9f69w,4.0,"{'id': 'qZBcwrnYI5vZyWcDGqFReQ', 'profile_url': 'https://www.yelp.com/user_details?userid=qZBcwrnYI5vZyWcDGqFReQ', 'image_url': 'https://s3-media3.fl.yelpcdn.com/photo/l0vNrgOH92SJjI-GaLeinw/o.jpg', 'name': 'Iván C.'}","Hace un par de días pasé por segunda vez frente a este local, y esta vez sí tuve tiempo para no desaprovechar la ocasión de entrar y conocer: es un pequeño...",2014-02-04 11:08:28,https://www.yelp.com/biz/beer-bros-m%C3%A9xico?adjust_creative=xDKeFNUg3YH3P2W3fl1X6g&hrid=Y0tVs8oqbjkX8SOn1UtGog&utm_campaign=yelp_api_v3&utm_medium=api_v3_business_reviews&utm_source=xDKeFNUg3YH3P2W3fl1X6g
9psgynpnN3Jcny4KTZn6GA,F9Vz6tbQLqAVl_jfCHHo5Q,4.0,"{'id': '20DUe88cqSSXdx79j__m9g', 'profile_url': 'https://www.yelp.com/user_details?userid=20DUe88cqSSXdx79j__m9g', 'image_url': 'https://s3-media3.fl.yelpcdn.com/photo/zdCzbIO3NWTEi6Da230lkA/o.jpg', 'name': 'Misti C.'}","En general, me parece que es un restaurante muy bien decorado, con un ambiente de estancia argentina y elegancia. 
Sin embargo, el servicio no fue de lo...",2016-09-12 11:09:34,https://www.yelp.com/biz/fonda-argentina-benito-ju%C3%A1rez?adjust_creative=xDKeFNUg3YH3P2W3fl1X6g&hrid=9psgynpnN3Jcny4KTZn6GA&utm_campaign=yelp_api_v3&utm_medium=api_v3_business_reviews&utm_source=xDKeFNUg3YH3P2W3fl1X6g
OUjOl7J_F-savivTR5WFJw,F9Vz6tbQLqAVl_jfCHHo5Q,4.0,"{'id': 'x-Cfb-0-xiTaR0S1CBQ8OA', 'profile_url': 'https://www.yelp.com/user_details?userid=x-Cfb-0-xiTaR0S1CBQ8OA', 'image_url': 'https://s3-media1.fl.yelpcdn.com/photo/5wGJrWj7g2emeD9D3m2M1Q/o.jpg', 'name': 'Carlos M.'}","Excelente carne , excelente servicio... todo súper familiar... no dejen de comer aquí!!!",2017-11-25 14:49:48,https://www.yelp.com/biz/fonda-argentina-benito-ju%C3%A1rez?adjust_creative=xDKeFNUg3YH3P2W3fl1X6g&hrid=OUjOl7J_F-savivTR5WFJw&utm_campaign=yelp_api_v3&utm_medium=api_v3_business_reviews&utm_source=xDKeFNUg3YH3P2W3fl1X6g
XsyT2lFMJUhy5c4gZgDuPA,F9Vz6tbQLqAVl_jfCHHo5Q,4.0,"{'id': 'S1ZSKDatAihrVH4duwiDWg', 'profile_url': 'https://www.yelp.com/user_details?userid=S1ZSKDatAihrVH4duwiDWg', 'image_url': 'https://s3-media1.fl.yelpcdn.com/photo/eNPdPETfTgaSNpV9ZZOirQ/o.jpg', 'name': 'Phanie C.'}","Papá es fan, mega fan de la carne. Y como buen ""hijo de tigre pintito"", no me pude quedar atrás. 

Ya sea cumpleaños, logros o simplemente por el gusto de...",2014-01-09 21:43:07,https://www.yelp.com/biz/fonda-argentina-benito-ju%C3%A1rez?adjust_creative=xDKeFNUg3YH3P2W3fl1X6g&hrid=XsyT2lFMJUhy5c4gZgDuPA&utm_campaign=yelp_api_v3&utm_medium=api_v3_business_reviews&utm_source=xDKeFNUg3YH3P2W3fl1X6g
tj0-nCt9UbWGMwW2rPTm5A,OEl1HJB0Yl8a6r5f7nveaw,3.0,"{'id': 'mGDtJ4LT_UVWm7yfemkwgA', 'profile_url': 'https://www.yelp.com/user_details?userid=mGDtJ4LT_UVWm7yfemkwgA', 'image_url': 'https://s3-media2.fl.yelpcdn.com/photo/nW9iTyuuzO1INH_olHTVwg/o.jpg', 'name': 'Eve R.'}","Es uno de los lugares más tradicionales de la colonia. La cerveza es barata, así como la comida. Es buenísimo para venir a ver el partido de fucho de la...",2016-02-22 22:14:11,https://www.yelp.com/biz/cervecer%C3%ADa-la-victoria-m%C3%A9xico-2?adjust_creative=xDKeFNUg3YH3P2W3fl1X6g&hrid=tj0-nCt9UbWGMwW2rPTm5A&utm_campaign=yelp_api_v3&utm_medium=api_v3_business_reviews&utm_source=xDKeFNUg3YH3P2W3fl1X6g
iuELInov0bF5Qw4ZePg_BA,OEl1HJB0Yl8a6r5f7nveaw,5.0,"{'id': 'xmXCl6HmsguYzLwm5TYQXg', 'profile_url': 'https://www.yelp.com/user_details?userid=xmXCl6HmsguYzLwm5TYQXg', 'image_url': 'https://s3-media4.fl.yelpcdn.com/photo/qbCdp5NYLPLP8ZlFexC_JA/o.jpg', 'name': 'Catalina M.'}","La querida Vicky es lo único interesante de la Álamos. La bola incluye botana y hay variedad de mariscos. Uno sale apestando a pescado invariablemente, pero...",2016-11-18 17:27:58,https://www.yelp.com/biz/cervecer%C3%ADa-la-victoria-m%C3%A9xico-2?adjust_creative=xDKeFNUg3YH3P2W3fl1X6g&hrid=iuELInov0bF5Qw4ZePg_BA&utm_campaign=yelp_api_v3&utm_medium=api_v3_business_reviews&utm_source=xDKeFNUg3YH3P2W3fl1X6g
Ob6jbtH7wX-f-gLZ0cqrLw,OEl1HJB0Yl8a6r5f7nveaw,2.0,"{'id': 'VmfQUyfbqY3XAKQH4v2DFg', 'profile_url': 'https://www.yelp.com/user_details?userid=VmfQUyfbqY3XAKQH4v2DFg', 'image_url': 'https://s3-media3.fl.yelpcdn.com/photo/b6rGx_jXzBxoprCuaeyrXw/o.jpg', 'name': 'Atzin S.'}","La cerveza a buen precio y hay de ambas compañías nacionales conocidas. La comida con mucho aceite, el pescado nada en el y por $60 no puedes pedir mucho...",2017-01-16 17:22:08,https://www.yelp.com/biz/cervecer%C3%ADa-la-victoria-m%C3%A9xico-2?adjust_creative=xDKeFNUg3YH3P2W3fl1X6g&hrid=Ob6jbtH7wX-f-gLZ0cqrLw&utm_campaign=yelp_api_v3&utm_medium=api_v3_business_reviews&utm_source=xDKeFNUg3YH3P2W3fl1X6g
AfVgzJo8yNHEUnYl1CaSYg,u--INeZ5_5RuRgyDoi6xfA,5.0,"{'id': 'OFYECHkwxsMAOuVDScWWJw', 'profile_url': 'https://www.yelp.com/user_details?userid=OFYECHkwxsMAOuVDScWWJw', 'image_url': 'https://s3-media1.fl.yelpcdn.com/photo/Hqjo5-U9V5dDimb5N6AHtQ/o.jpg', 'name': 'Oscar M.'}","Me encanta este lugar. Las hamburgues son muy buenas y porciones muy abundates. La hamburguesa Esta Kbrón le hace honor a su nombre, la recomiendo...",2018-02-17 13:08:16,https://www.yelp.com/biz/est%C3%A1-krb%C3%B3n-ciudad-de-m%C3%A9xico?adjust_creative=xDKeFNUg3YH3P2W3fl1X6g&hrid=AfVgzJo8yNHEUnYl1CaSYg&utm_campaign=yelp_api_v3&utm_medium=api_v3_business_reviews&utm_source=xDKeFNUg3YH3P2W3fl1X6g
e2aTZ5_8TjT0XjeO0SP3ZQ,u--INeZ5_5RuRgyDoi6xfA,5.0,"{'id': 'LxDpQzcu3qkPXyL12eNonw', 'profile_url': 'https://www.yelp.com/user_details?userid=LxDpQzcu3qkPXyL12eNonw', 'image_url': 'https://s3-media2.fl.yelpcdn.com/photo/nuEKB0YQCGKXGXTDwFcw6w/o.jpg', 'name': 'Javier V.'}",Mis amigos élites gus y raul me trajeron a este lugar y vaya sorpresa aquí en la narvarte pobre lo que creo es la hamburguesa más rica de queso azul que...,2015-09-20 07:03:31,https://www.yelp.com/biz/est%C3%A1-krb%C3%B3n-ciudad-de-m%C3%A9xico?adjust_creative=xDKeFNUg3YH3P2W3fl1X6g&hrid=e2aTZ5_8TjT0XjeO0SP3ZQ&utm_campaign=yelp_api_v3&utm_medium=api_v3_business_reviews&utm_source=xDKeFNUg3YH3P2W3fl1X6g
beLKxO7Llz1a5YhGQ4XbVA,u--INeZ5_5RuRgyDoi6xfA,5.0,"{'id': 'CZD-hrp7gNcRgtTsCgwxQg', 'profile_url': 'https://www.yelp.com/user_details?userid=CZD-hrp7gNcRgtTsCgwxQg', 'image_url': 'https://s3-media2.fl.yelpcdn.com/photo/QdeZ_q8TQHX1BoaXYOqGiQ/o.jpg', 'name': 'Patricia V.'}","Hamburguesas, hot dogs y cortes deliciosos. Yo pedí una hamburguesa de 150 grms con chicharrón de queso y champiñones, acompañada de aros de cebolla y está...",2016-01-06 15:05:30,https://www.yelp.com/biz/est%C3%A1-krb%C3%B3n-ciudad-de-m%C3%A9xico?adjust_creative=xDKeFNUg3YH3P2W3fl1X6g&hrid=beLKxO7Llz1a5YhGQ4XbVA&utm_campaign=yelp_api_v3&utm_medium=api_v3_business_reviews&utm_source=xDKeFNUg3YH3P2W3fl1X6g
rO2FXt-BR5fdiKz2EVahBQ,JHNWQiJPD6mnKBTDaBhREg,5.0,"{'id': 'oBT6dnQF7JHTjyKCg0q4MA', 'profile_url': 'https://www.yelp.com/user_details?userid=oBT6dnQF7JHTjyKCg0q4MA', 'image_url': 'https://s3-media2.fl.yelpcdn.com/photo/Pof_DIXfnB6W7cawoWBLew/o.jpg', 'name': 'Mario M.'}","El ""dos"" de este Hop experience está bien ganado: el lugar es un gran bodegón con food truck, alambiques, bancas de madera y tienda de chelas all in one. Su...",2016-10-24 19:43:32,https://www.yelp.com/biz/hop-the-beer-experience-2-ciudad-de-m%C3%A9xico?adjust_creative=xDKeFNUg3YH3P2W3fl1X6g&hrid=rO2FXt-BR5fdiKz2EVahBQ&utm_campaign=yelp_api_v3&utm_medium=api_v3_business_reviews&utm_source=xDKeFNUg3YH3P2W3fl1X6g
TXVD6zMF5Yjo1Wynrs2PDw,JHNWQiJPD6mnKBTDaBhREg,1.0,"{'id': 'x-Cfb-0-xiTaR0S1CBQ8OA', 'profile_url': 'https://www.yelp.com/user_details?userid=x-Cfb-0-xiTaR0S1CBQ8OA', 'image_url': 'https://s3-media1.fl.yelpcdn.com/photo/5wGJrWj7g2emeD9D3m2M1Q/o.jpg', 'name': 'Carlos M.'}","Se ve muy padre, pero la comida deja mucho que desear, el menú de las cervezas se encuentra en linea y no da ningún tipo de descripción de estas, el mesero...",2017-11-03 17:06:32,https://www.yelp.com/biz/hop-the-beer-experience-2-ciudad-de-m%C3%A9xico?adjust_creative=xDKeFNUg3YH3P2W3fl1X6g&hrid=TXVD6zMF5Yjo1Wynrs2PDw&utm_campaign=yelp_api_v3&utm_medium=api_v3_business_reviews&utm_source=xDKeFNUg3YH3P2W3fl1X6g
9xvAoCXpHfFMNmhnlYdHEw,JHNWQiJPD6mnKBTDaBhREg,1.0,"{'id': 'CmhClBC08iz9uEUKqmXu3A', 'profile_url': 'https://www.yelp.com/user_details?userid=CmhClBC08iz9uEUKqmXu3A', 'image_url': 'https://s3-media3.fl.yelpcdn.com/photo/J3aW4XrLaRggmFcW7whGYw/o.jpg', 'name': 'Betzabe J.'}","La comida no es necesariamente buena pero el servicio es pésimo, el mesero confundió nuestra orden y además nos culpó por su falta de atención, la carta de...",2017-06-03 22:09:45,https://www.yelp.com/biz/hop-the-beer-experience-2-ciudad-de-m%C3%A9xico?adjust_creative=xDKeFNUg3YH3P2W3fl1X6g&hrid=9xvAoCXpHfFMNmhnlYdHEw&utm_campaign=yelp_api_v3&utm_medium=api_v3_business_reviews&utm_source=xDKeFNUg3YH3P2W3fl1X6g
WwtdbGLseSXSGSGxSUQpBA,5Nj7ZDTorSGOVW6hh1Zh8A,4.0,"{'id': 'QpYkWu3mRI-ZV-Lv8hC-Vg', 'profile_url': 'https://www.yelp.com/user_details?userid=QpYkWu3mRI-ZV-Lv8hC-Vg', 'image_url': 'https://s3-media1.fl.yelpcdn.com/photo/i4J8NfrgUruaMxyvkyFQ9g/o.jpg', 'name': 'Cuaui R.'}","Paraíso o lugar de origen o lugar de reunión de la comunidad hipster!!! Jajaja

Cuándo ir...
En bola con tus amigos.

Qué te pone de buenas...
El lugar
El...",2016-08-08 14:09:02,https://www.yelp.com/biz/cine-tonal%C3%A1-m%C3%A9xico?adjust_creative=xDKeFNUg3YH3P2W3fl1X6g&hrid=WwtdbGLseSXSGSGxSUQpBA&utm_campaign=yelp_api_v3&utm_medium=api_v3_business_reviews&utm_source=xDKeFNUg3YH3P2W3fl1X6g
gZNeobLWamIxSyWDuuhF1Q,5Nj7ZDTorSGOVW6hh1Zh8A,3.0,"{'id': '3kd2sjtPfVeg5VjQHaeXXQ', 'profile_url': 'https://www.yelp.com/user_details?userid=3kd2sjtPfVeg5VjQHaeXXQ', 'image_url': 'https://s3-media1.fl.yelpcdn.com/photo/x7zJ5R0HsJMuQJrUDogxPw/o.jpg', 'name': 'Israel C.'}","Acabo descubrir que este lugar tiene brunch.

Tiene barra de ensaladas fruta y verduras, jugos, carnes frías, quesos, cereal y puedes elegir un platillo...",2016-04-04 12:13:19,https://www.yelp.com/biz/cine-tonal%C3%A1-m%C3%A9xico?adjust_creative=xDKeFNUg3YH3P2W3fl1X6g&hrid=gZNeobLWamIxSyWDuuhF1Q&utm_campaign=yelp_api_v3&utm_medium=api_v3_business_reviews&utm_source=xDKeFNUg3YH3P2W3fl1X6g
S2CG-Z36X0t_UN8aPqShHA,5Nj7ZDTorSGOVW6hh1Zh8A,4.0,"{'id': 'NS0w_5-UsP99uKT8xJqE3A', 'profile_url': 'https://www.yelp.com/user_details?userid=NS0w_5-UsP99uKT8xJqE3A', 'image_url': 'https://s3-media4.fl.yelpcdn.com/photo/TRbKdaej4shogmwYzr7eWg/o.jpg', 'name': 'Adri O.'}",Un cine hipsteron escondido en la Roma con una cartelera muy interesante. Nada caro y a los vecinos les hacen un 15% de descuento. El atractivo además de...,2016-02-04 10:19:37,https://www.yelp.com/biz/cine-tonal%C3%A1-m%C3%A9xico?adjust_creative=xDKeFNUg3YH3P2W3fl1X6g&hrid=S2CG-Z36X0t_UN8aPqShHA&utm_campaign=yelp_api_v3&utm_medium=api_v3_business_reviews&utm_source=xDKeFNUg3YH3P2W3fl1X6g
XfhsvQhcqpees1uwN4_Stw,i9N52mZOG0W0fu-IEYiwoQ,5.0,"{'id': 'OQOpAJTJdVlGR1J5wusImQ', 'profile_url': 'https://www.yelp.com/user_details?userid=OQOpAJTJdVlGR1J5wusImQ', 'image_url': 'https://s3-media2.fl.yelpcdn.com/photo/tVLm07TNLMNyo2fzk1lcSQ/o.jpg', 'name': 'Jimena R.'}","Me encanta este lugar por la comida, la 
decoración (como si estuvieras en un patio en el sur de Estados Unidos) y el ambiente. Como todo lugar de bbq, es...",2017-11-18 09:51:31,https://www.yelp.com/biz/pinche-gringo-bbq-cuidad-de-mexico?adjust_creative=xDKeFNUg3YH3P2W3fl1X6g&hrid=XfhsvQhcqpees1uwN4_Stw&utm_campaign=yelp_api_v3&utm_medium=api_v3_business_reviews&utm_source=xDKeFNUg3YH3P2W3fl1X6g
qqckxbAwrJs6M2JchaUK8A,i9N52mZOG0W0fu-IEYiwoQ,5.0,"{'id': '92ELJKPCAWQGau-jojnAdQ', 'profile_url': 'https://www.yelp.com/user_details?userid=92ELJKPCAWQGau-jojnAdQ', 'image_url': 'https://s3-media1.fl.yelpcdn.com/photo/FGvE68LdtRqJPDfVkmvyng/o.jpg', 'name': 'German L.'}","Restaurante muy americano, con porciones sumamente generosas, bien preparadas y buen sazón. El BBQ es simplemente exquisito. Las guarniciones están en su...",2018-10-02 10:55:55,https://www.yelp.com/biz/pinche-gringo-bbq-cuidad-de-mexico?adjust_creative=xDKeFNUg3YH3P2W3fl1X6g&hrid=qqckxbAwrJs6M2JchaUK8A&utm_campaign=yelp_api_v3&utm_medium=api_v3_business_reviews&utm_source=xDKeFNUg3YH3P2W3fl1X6g
5VuWyAz2MRjKbkGxtjCtRw,i9N52mZOG0W0fu-IEYiwoQ,3.0,"{'id': 'HjoNrP7ukTO3MEQ3FrAWlA', 'profile_url': 'https://www.yelp.com/user_details?userid=HjoNrP7ukTO3MEQ3FrAWlA', 'image_url': 'https://s3-media3.fl.yelpcdn.com/photo/vMUN5fbaBziQWbvLhfDmfw/o.jpg', 'name': 'Angel P.'}","La comida es muy buena, pero el menú muy limitado, la atención no es la mejor y la logística que tienen hace que a uno no le den ganas de regresar.
Lo peor...",2017-07-09 14:55:38,https://www.yelp.com/biz/pinche-gringo-bbq-cuidad-de-mexico?adjust_creative=xDKeFNUg3YH3P2W3fl1X6g&hrid=5VuWyAz2MRjKbkGxtjCtRw&utm_campaign=yelp_api_v3&utm_medium=api_v3_business_reviews&utm_source=xDKeFNUg3YH3P2W3fl1X6g
Dx8tDWqgpWdukZDt_hA2NA,9vrA1fTxt0KSYZ7BVeUGMQ,4.0,"{'id': '_VBHhQlFrlw0avSq5FLBhg', 'profile_url': 'https://www.yelp.com/user_details?userid=_VBHhQlFrlw0avSq5FLBhg', 'image_url': 'https://s3-media4.fl.yelpcdn.com/photo/70QiMstpq-maJnypiQNPXA/o.jpg', 'name': 'Juan R.'}",Lo que me sorprendió de este lugar es que son súper rápidos y eficaz. Parece qué hay buena comunicación entre los meseros y todo el personal. Tienen que...,2018-07-21 12:30:53,https://www.yelp.com/biz/la-casa-de-to%C3%B1o-m%C3%A9xico-6?adjust_creative=xDKeFNUg3YH3P2W3fl1X6g&hrid=Dx8tDWqgpWdukZDt_hA2NA&utm_campaign=yelp_api_v3&utm_medium=api_v3_business_reviews&utm_source=xDKeFNUg3YH3P2W3fl1X6g
OJRJ2y0na6wwntQbkbZnEQ,9vrA1fTxt0KSYZ7BVeUGMQ,4.0,"{'id': 'dNa64hI5DTOugDn8cLWZAQ', 'profile_url': 'https://www.yelp.com/user_details?userid=dNa64hI5DTOugDn8cLWZAQ', 'image_url': 'https://s3-media2.fl.yelpcdn.com/photo/2CLYEe9lRIaLqOdsL5QACw/o.jpg', 'name': 'Daniel R.'}","La casa de toño es uno de los primeros lugares en lo que pienso en comer cuando visito la Ciudad de México y la verdad me gusta mucho. 
Todos sus platillos...",2016-09-03 19:28:39,https://www.yelp.com/biz/la-casa-de-to%C3%B1o-m%C3%A9xico-6?adjust_creative=xDKeFNUg3YH3P2W3fl1X6g&hrid=OJRJ2y0na6wwntQbkbZnEQ&utm_campaign=yelp_api_v3&utm_medium=api_v3_business_reviews&utm_source=xDKeFNUg3YH3P2W3fl1X6g
RS37RRnWhbUc5mjsVsDSbQ,9vrA1fTxt0KSYZ7BVeUGMQ,4.0,"{'id': 'RX1D12KuO7FDcLZR5AOVrQ', 'profile_url': 'https://www.yelp.com/user_details?userid=RX1D12KuO7FDcLZR5AOVrQ', 'image_url': 'https://s3-media2.fl.yelpcdn.com/photo/w5vzV7h4BJtDHYAwGe9mcA/o.jpg', 'name': 'Diana S.'}","Muy bien por esta cadena de comida garnachera. Se ha ganado un lugar en los corazones de los chilangos, y de los extranjeros buen pedo que vienen en plan de...",2016-06-08 18:48:43,https://www.yelp.com/biz/la-casa-de-to%C3%B1o-m%C3%A9xico-6?adjust_creative=xDKeFNUg3YH3P2W3fl1X6g&hrid=RS37RRnWhbUc5mjsVsDSbQ&utm_campaign=yelp_api_v3&utm_medium=api_v3_business_reviews&utm_source=xDKeFNUg3YH3P2W3fl1X6g
FAvLu2rW0_RfeTfvGbim1g,KZuhFaDhcRqyLWCdz9fOWA,5.0,"{'id': '9RxHc9hLVEOcX5dkuSYXIg', 'profile_url': 'https://www.yelp.com/user_details?userid=9RxHc9hLVEOcX5dkuSYXIg', 'image_url': 'https://s3-media1.fl.yelpcdn.com/photo/mNGvljqBIsU2vHs9j6WMEQ/o.jpg', 'name': 'Omar Alejandro M.'}",Central de Pizzas es la clase de lugar que realmente te invita a regresar y recorrer la carta completa. Originalmente me dirigía a Plaza Delta pero mi chica...,2017-11-13 13:06:36,https://www.yelp.com/biz/central-de-pizzas-m%C3%A9xico-4?adjust_creative=xDKeFNUg3YH3P2W3fl1X6g&hrid=FAvLu2rW0_RfeTfvGbim1g&utm_campaign=yelp_api_v3&utm_medium=api_v3_business_reviews&utm_source=xDKeFNUg3YH3P2W3fl1X6g
4IbVBdBSWvuajypZw5qYTA,KZuhFaDhcRqyLWCdz9fOWA,1.0,"{'id': 'ZXFEGspnf2SdlKmOlXeCyw', 'profile_url': 'https://www.yelp.com/user_details?userid=ZXFEGspnf2SdlKmOlXeCyw', 'image_url': 'https://s3-media2.fl.yelpcdn.com/photo/VfhmC-R9M0sbDsypDRffaA/o.jpg', 'name': 'Ian C.'}","Y de tanto caminar,llegamos a este lugar que muchos consideran como uno de los mejores exponentes de pizzas en la zona sur del df ,lamento ser yo quien...",2015-12-06 00:08:11,https://www.yelp.com/biz/central-de-pizzas-m%C3%A9xico-4?adjust_creative=xDKeFNUg3YH3P2W3fl1X6g&hrid=4IbVBdBSWvuajypZw5qYTA&utm_campaign=yelp_api_v3&utm_medium=api_v3_business_reviews&utm_source=xDKeFNUg3YH3P2W3fl1X6g
2jU4meAfhe0UI-Plp6myEg,KZuhFaDhcRqyLWCdz9fOWA,5.0,"{'id': 'WrmU_kjzLFTHTGBivk8xOw', 'profile_url': 'https://www.yelp.com/user_details?userid=WrmU_kjzLFTHTGBivk8xOw', 'image_url': 'https://s3-media3.fl.yelpcdn.com/photo/OI9GrTRm4-TdQvEgQOOvjA/o.jpg', 'name': 'Maru W.'}","La primera vez que fui a Central de Pizzas fue porque un amigo me recomendó este local, sabiendo que amo la comida italiana. Era mi aniversario y quise ir a...",2014-01-08 14:52:00,https://www.yelp.com/biz/central-de-pizzas-m%C3%A9xico-4?adjust_creative=xDKeFNUg3YH3P2W3fl1X6g&hrid=2jU4meAfhe0UI-Plp6myEg&utm_campaign=yelp_api_v3&utm_medium=api_v3_business_reviews&utm_source=xDKeFNUg3YH3P2W3fl1X6g
3DsJOoi2SZmISPrX5WSMWg,UrezCP1b88Km2SzI9naZ2Q,4.0,"{'id': 'I3ScxfzbbVVz3MUvsjmItg', 'profile_url': 'https://www.yelp.com/user_details?userid=I3ScxfzbbVVz3MUvsjmItg', 'image_url': 'https://s3-media4.fl.yelpcdn.com/photo/exaBfxoiS4cMrFxC83nRLg/o.jpg', 'name': 'Cristian P.'}","Henry Sailor es un pequeño local en la colonia Navarte,  justo enfrente de los tacos El Vilsito.  Cuenta con una variedad de mariscos y cervezas artesanales...",2016-09-10 20:26:48,https://www.yelp.com/biz/henry-sailor-m%C3%A9xico?adjust_creative=xDKeFNUg3YH3P2W3fl1X6g&hrid=3DsJOoi2SZmISPrX5WSMWg&utm_campaign=yelp_api_v3&utm_medium=api_v3_business_reviews&utm_source=xDKeFNUg3YH3P2W3fl1X6g
