id,bussinessid,rating,user,text,time_created,url
CqcXuPrrCls-dza0GbfAHw,fvooHE21pWYUMtZb-hMC0w,5.0,"{'id': 'Q5IwVS4KqNg949se7lqf5g', 'profile_url': 'https://www.yelp.com/user_details?userid=Q5IwVS4KqNg949se7lqf5g', 'image_url': 'https://s3-media2.fl.yelpcdn.com/photo/74G0zDl5UiWnLQ1vWoahFg/o.jpg', 'name': 'María Laura G.'}","""La casa del bauce"" es una taquería muy particular, con alrededor de 30 años de antigüedad, mantiene la misma pinta del local, hasta el mismo sabor y el...",2013-12-19 19:15:33,https://www.yelp.com/biz/tacos-la-casa-del-bauce-m%C3%A9xico?adjust_creative=xDKeFNUg3YH3P2W3fl1X6g&hrid=CqcXuPrrCls-dza0GbfAHw&utm_campaign=yelp_api_v3&utm_medium=api_v3_business_reviews&utm_source=xDKeFNUg3YH3P2W3fl1X6g
E_V7zLtE6NNH0vyhnSml2w,gTId1hYYjXMUH-L-bG3Gjg,5.0,"{'id': '1oRY3BR3LbZDtOu1AZ6fuQ', 'profile_url': 'https://www.yelp.com/user_details?userid=1oRY3BR3LbZDtOu1AZ6fuQ', 'image_url': 'https://s3-media4.fl.yelpcdn.com/photo/ThfbPBVMc_s6Ny1p-BTxSw/o.jpg', 'name': 'Dan M.'}","Las hamburguesas MEMOrribles son una excelente opción cuando tienes hambre y mucho antojo de una hamburguesa rica, con hartas papas y no quieres la clásica...",2016-05-05 11:50:10,https://www.yelp.com/biz/hamburguesas-hm-m%C3%A9xico-4?adjust_creative=xDKeFNUg3YH3P2W3fl1X6g&hrid=E_V7zLtE6NNH0vyhnSml2w&utm_campaign=yelp_api_v3&utm_medium=api_v3_business_reviews&utm_source=xDKeFNUg3YH3P2W3fl1X6g
sHP1AhkX3tDmieIrU4D5iQ,gTId1hYYjXMUH-L-bG3Gjg,4.0,"{'id': 'lY7oEmqNftC-LwimQs-ZPQ', 'profile_url': 'https://www.yelp.com/user_details?userid=lY7oEmqNftC-LwimQs-ZPQ', 'image_url': 'https://s3-media2.fl.yelpcdn.com/photo/Yw9Q2Opn-Ob4uWhaJPtqSg/o.jpg', 'name': 'Alaíde V.'}","Estas hamburguesas sí son memorables, pero para mi gusto, más memorables son sus papitas. Mis favoritas son las curly (no hay muchos lugares donde las...",2014-01-31 13:17:48,https://www.yelp.com/biz/hamburguesas-hm-m%C3%A9xico-4?adjust_creative=xDKeFNUg3YH3P2W3fl1X6g&hrid=sHP1AhkX3tDmieIrU4D5iQ&utm_campaign=yelp_api_v3&utm_medium=api_v3_business_reviews&utm_source=xDKeFNUg3YH3P2W3fl1X6g
usI9asjEKOn3F7xGFyRbCg,gTId1hYYjXMUH-L-bG3Gjg,4.0,"{'id': 'DCy05VQh97F0ceCvfDQLvg', 'profile_url': 'https://www.yelp.com/user_details?userid=DCy05VQh97F0ceCvfDQLvg', 'image_url': 'https://s3-media2.fl.yelpcdn.com/photo/ybNIS2dgPS7ECyFreUPOSA/o.jpg', 'name': 'Pablo M.'}","Este negocio se llamaba las Hamburguesas Memorables, seguramente porque su dueño se llama Guillermo. Pero después de un cambio de imagen, perdieron el...",2014-02-09 18:12:51,https://www.yelp.com/biz/hamburguesas-hm-m%C3%A9xico-4?adjust_creative=xDKeFNUg3YH3P2W3fl1X6g&hrid=usI9asjEKOn3F7xGFyRbCg&utm_campaign=yelp_api_v3&utm_medium=api_v3_business_reviews&utm_source=xDKeFNUg3YH3P2W3fl1X6g
50Ca0waPN6Uz7AHQFS6jLw,3-96BykRLxA1ktow5AU3lA,4.0,"{'id': 'Ols3MBBowNSfyBsBv2EyMQ', 'profile_url': 'https://www.yelp.com/user_details?userid=Ols3MBBowNSfyBsBv2EyMQ', 'image_url': 'https://s3-media4.fl.yelpcdn.com/photo/b0LfSmlbD9k8N76z_UmDXQ/o.jpg', 'name': 'Bernardo B.'}","En sus relaciones sociales, él tenían un tipo de personalidad seria, acaso sin gracia que, ponía incómoda a los demás, incluso a los frívolos. ¡Ahh! Qué...",2014-02-08 15:53:44,https://www.yelp.com/biz/aah-carb%C3%B3n-m%C3%A9xico?adjust_creative=xDKeFNUg3YH3P2W3fl1X6g&hrid=50Ca0waPN6Uz7AHQFS6jLw&utm_campaign=yelp_api_v3&utm_medium=api_v3_business_reviews&utm_source=xDKeFNUg3YH3P2W3fl1X6g
QN1Dp1r2MUWTYIXd-wTmOg,3-96BykRLxA1ktow5AU3lA,4.0,"{'id': 'tYoW0VMvNx--TbsM4MNgJw', 'profile_url': 'https://www.yelp.com/user_details?userid=tYoW0VMvNx--TbsM4MNgJw', 'image_url': 'https://s3-media3.fl.yelpcdn.com/photo/PUvhoZw7j1hc8cPk0pw_Dg/o.jpg', 'name': 'Eduardo R.'}","Este maravilloso lugar lo tiene todo. La comida más grasienta y llena de carbohidratos, pero sobre todo rica, porque siendo sinceros a todos no se encanta...",2014-02-05 16:24:38,https://www.yelp.com/biz/aah-carb%C3%B3n-m%C3%A9xico?adjust_creative=xDKeFNUg3YH3P2W3fl1X6g&hrid=QN1Dp1r2MUWTYIXd-wTmOg&utm_campaign=yelp_api_v3&utm_medium=api_v3_business_reviews&utm_source=xDKeFNUg3YH3P2W3fl1X6g
FXN9z3BBFNgbkESRTfFwzQ,r3M_ICyJRApW-BiZf1CSCA,5.0,"{'id': 'b6TEn_z0UR0bW3BHWufnew', 'profile_url': 'https://www.yelp.com/user_details?userid=b6TEn_z0UR0bW3BHWufnew', 'image_url': 'https://s3-media3.fl.yelpcdn.com/photo/WTcnsSH8ycZPP5FVMJMZ0w/o.jpg', 'name': 'Pam V.'}","Están muy buenos los paquetes que manejan, 5 tipos de hamburguesa, tres diferentes gramajes de carne para elegir. Las a hamburguesas súper ricas, todas...",2015-12-20 18:18:31,https://www.yelp.com/biz/big-burguer-m%C3%A9xico?adjust_creative=xDKeFNUg3YH3P2W3fl1X6g&hrid=FXN9z3BBFNgbkESRTfFwzQ&utm_campaign=yelp_api_v3&utm_medium=api_v3_business_reviews&utm_source=xDKeFNUg3YH3P2W3fl1X6g
-jbzNwNO23hnRS7u8PvEcQ,r3M_ICyJRApW-BiZf1CSCA,3.0,"{'id': 'ukQdTaJNdb9-IZk06-RuSw', 'profile_url': 'https://www.yelp.com/user_details?userid=ukQdTaJNdb9-IZk06-RuSw', 'image_url': 'https://s3-media3.fl.yelpcdn.com/photo/n2jNMkN0MYMad3BtDnuQ2w/o.jpg', 'name': 'Puro B.'}","Las hamburguesas no están mal, no son mis preferidas la verdad. Pero cumplen su propósito. Las papitas si son buenas pero los jochos sensacionales usan...",2015-12-21 08:04:13,https://www.yelp.com/biz/big-burguer-m%C3%A9xico?adjust_creative=xDKeFNUg3YH3P2W3fl1X6g&hrid=-jbzNwNO23hnRS7u8PvEcQ&utm_campaign=yelp_api_v3&utm_medium=api_v3_business_reviews&utm_source=xDKeFNUg3YH3P2W3fl1X6g
cVUjVIHTAWFrXWHhA40mvQ,r3M_ICyJRApW-BiZf1CSCA,5.0,"{'id': 'oBT6dnQF7JHTjyKCg0q4MA', 'profile_url': 'https://www.yelp.com/user_details?userid=oBT6dnQF7JHTjyKCg0q4MA', 'image_url': 'https://s3-media2.fl.yelpcdn.com/photo/Pof_DIXfnB6W7cawoWBLew/o.jpg', 'name': 'Mario M.'}","Es un mini localillo que descubrimos al dejar la EcoBici en la estación de Anaxagoras, que es la más cercana a a Plaza Troll o Parque Delta. Bueno pues a...",2015-09-06 14:35:55,https://www.yelp.com/biz/big-burguer-m%C3%A9xico?adjust_creative=xDKeFNUg3YH3P2W3fl1X6g&hrid=cVUjVIHTAWFrXWHhA40mvQ&utm_campaign=yelp_api_v3&utm_medium=api_v3_business_reviews&utm_source=xDKeFNUg3YH3P2W3fl1X6g
yqZRLs__bbYmY3P6AQRTjQ,tcD0bCvSrLt99bkqej6Ctg,4.0,"{'id': 'S9auutcJ15XlSv5Xbj28IA', 'profile_url': 'https://www.yelp.com/user_details?userid=S9auutcJ15XlSv5Xbj28IA', 'image_url': 'https://s3-media2.fl.yelpcdn.com/photo/iPmE3SeUE_p_alWRjumzuw/o.jpg', 'name': 'Jorge W.'}",Lugar oldie estilo años 80s 90s con muchas cosas que te haran recordar tu infancia desde esoa patines de netal hasta el intelevision atari y boletos del...,2015-10-17 09:02:21,https://www.yelp.com/biz/gofox-m%C3%A9xico?adjust_creative=xDKeFNUg3YH3P2W3fl1X6g&hrid=yqZRLs__bbYmY3P6AQRTjQ&utm_campaign=yelp_api_v3&utm_medium=api_v3_business_reviews&utm_source=xDKeFNUg3YH3P2W3fl1X6g
DguoinLPwKV6HyCOSHKdxw,AQybZYuIVABPsf42pNtKgw,5.0,"{'id': 'AfOrHD526hQpK1dbf_ep1Q', 'profile_url': 'https://www.yelp.com/user_details?userid=AfOrHD526hQpK1dbf_ep1Q', 'image_url': None, 'name': 'José De Jesús N.'}","No tengo el gusto de conocer tan agradable lugar culinario,pero espero algún día poder visitarlo pronto",2019-12-29 11:25:52,https://www.yelp.com/biz/burgerama-gourmet-m%C3%A9xico?adjust_creative=xDKeFNUg3YH3P2W3fl1X6g&hrid=DguoinLPwKV6HyCOSHKdxw&utm_campaign=yelp_api_v3&utm_medium=api_v3_business_reviews&utm_source=xDKeFNUg3YH3P2W3fl1X6g
U0baNOOMrbQBMhKYhsuYmg,AQybZYuIVABPsf42pNtKgw,5.0,"{'id': 'aoP7439j1IL1Actxs82UHg', 'profile_url': 'https://www.yelp.com/user_details?userid=aoP7439j1IL1Actxs82UHg', 'image_url': None, 'name': 'Miguel B.'}","Hasta ahora han sido las mejores hamburguesas que he probado. El ambiente es afable, el servicio es muy rápido y bueno, la carne uffff deliciosa, super bien...",2019-07-11 20:21:40,https://www.yelp.com/biz/burgerama-gourmet-m%C3%A9xico?adjust_creative=xDKeFNUg3YH3P2W3fl1X6g&hrid=U0baNOOMrbQBMhKYhsuYmg&utm_campaign=yelp_api_v3&utm_medium=api_v3_business_reviews&utm_source=xDKeFNUg3YH3P2W3fl1X6g
7yrjOp6sA8sAmQ2qmnpIvg,AQybZYuIVABPsf42pNtKgw,4.0,"{'id': 'Ok5vssfYFOeqLX4iLd8Qxw', 'profile_url': 'https://www.yelp.com/user_details?userid=Ok5vssfYFOeqLX4iLd8Qxw', 'image_url': 'https://s3-media2.fl.yelpcdn.com/photo/eSodVjudn_Uth9joDcv97Q/o.jpg', 'name': 'Tomas C.'}","Muy buena calidad y variedad tanto en hamburguesas y hot dogs, precios un poco altos pero valen la pena, más si piensas que son superiores a los precios que...",2016-07-22 18:26:01,https://www.yelp.com/biz/burgerama-gourmet-m%C3%A9xico?adjust_creative=xDKeFNUg3YH3P2W3fl1X6g&hrid=7yrjOp6sA8sAmQ2qmnpIvg&utm_campaign=yelp_api_v3&utm_medium=api_v3_business_reviews&utm_source=xDKeFNUg3YH3P2W3fl1X6g
z08Te3g7S2qohcxjnGxK_w,IgIfWKiW0S87L_Rs7eTnVA,4.0,"{'id': 'JfGlo0ftvjzHzaZc6FBzjQ', 'profile_url': 'https://www.yelp.com/user_details?userid=JfGlo0ftvjzHzaZc6FBzjQ', 'image_url': 'https://s3-media1.fl.yelpcdn.com/photo/2kDVxwtIfSJLkirdu1YWXw/o.jpg', 'name': 'Victor Manuel M.'}",Es un buen lugar accesible y un buen negocio local cambiaron de domicilio están ahora en la calle de niños héroes pero definitivamente ya tiene más lugar...,2016-05-14 19:56:08,https://www.yelp.com/biz/los-primazos-m%C3%A9xico?adjust_creative=xDKeFNUg3YH3P2W3fl1X6g&hrid=z08Te3g7S2qohcxjnGxK_w&utm_campaign=yelp_api_v3&utm_medium=api_v3_business_reviews&utm_source=xDKeFNUg3YH3P2W3fl1X6g
fnFbD-ZaJ_k449yrUInsWA,vKUplzsXAKdFngQxGrfbiQ,4.0,"{'id': '8ybT3vU6TUi0xZNgitXPBw', 'profile_url': 'https://www.yelp.com/user_details?userid=8ybT3vU6TUi0xZNgitXPBw', 'image_url': 'https://s3-media1.fl.yelpcdn.com/photo/yu_cW7r_7_UXobdn57ct0Q/o.jpg', 'name': 'Karla G.'}","Un domingo por la tarde-noche o cualquier día de la semana que tengas antojo de hamburguesas de excelente calidad y, sobre todo, con gran variedad de...",2013-12-23 00:55:26,https://www.yelp.com/biz/yagos-grill-cuidad-de-m%C3%A9xico?adjust_creative=xDKeFNUg3YH3P2W3fl1X6g&hrid=fnFbD-ZaJ_k449yrUInsWA&utm_campaign=yelp_api_v3&utm_medium=api_v3_business_reviews&utm_source=xDKeFNUg3YH3P2W3fl1X6g
bM1PpUvFRp_34hWkM48vpw,vKUplzsXAKdFngQxGrfbiQ,4.0,"{'id': 'Z2Xle4WJJEF_xzGjPvVO4Q', 'profile_url': 'https://www.yelp.com/user_details?userid=Z2Xle4WJJEF_xzGjPvVO4Q', 'image_url': 'https://s3-media4.fl.yelpcdn.com/photo/0z2yscQBn1Mofsq78mz6Og/o.jpg', 'name': 'Edgar G.'}","Un admirador de la buena hamburguesa no puede morir sin haber visitado este local, que no tiene nada de especial, salvo vender las mejores hamburguesas del...",2014-01-27 20:45:44,https://www.yelp.com/biz/yagos-grill-cuidad-de-m%C3%A9xico?adjust_creative=xDKeFNUg3YH3P2W3fl1X6g&hrid=bM1PpUvFRp_34hWkM48vpw&utm_campaign=yelp_api_v3&utm_medium=api_v3_business_reviews&utm_source=xDKeFNUg3YH3P2W3fl1X6g
dD0p_WxuyzFbBq05zht0GA,XRKLyF9FgM4dutWnjM1oqg,3.0,"{'id': 'Jgct4wuJGwZgB88NFbL6jg', 'profile_url': 'https://www.yelp.com/user_details?userid=Jgct4wuJGwZgB88NFbL6jg', 'image_url': 'https://s3-media3.fl.yelpcdn.com/photo/DlmCiiS_E65EICFkOKnxuw/o.jpg', 'name': 'Luis M. M.'}",Había desayunado en la sucursal de Santa Fe. Una mala experiencia que tiene su propia reseña. En esta ocasión quise darle la oportunidad al turno del...,2018-05-06 06:49:47,https://www.yelp.com/biz/the-cheesecake-factory-ciudad-de-m%C3%A9xico-2?adjust_creative=xDKeFNUg3YH3P2W3fl1X6g&hrid=dD0p_WxuyzFbBq05zht0GA&utm_campaign=yelp_api_v3&utm_medium=api_v3_business_reviews&utm_source=xDKeFNUg3YH3P2W3fl1X6g
NbEE3MfzRASA-J_4PCNMHw,XRKLyF9FgM4dutWnjM1oqg,1.0,"{'id': 'lMrSS_XHWC7J4CS_EsUvhQ', 'profile_url': 'https://www.yelp.com/user_details?userid=lMrSS_XHWC7J4CS_EsUvhQ', 'image_url': 'https://s3-media4.fl.yelpcdn.com/photo/rp_zGtoLXOChpNwuooJn2w/o.jpg', 'name': 'Chely C.'}",Qué lástima que no puedo poner -5 estrellas a este changarro wanna be de la cadena gringa (síganle dando de comer a los que menos nos quieren...) la actitud...,2016-12-21 15:17:47,https://www.yelp.com/biz/the-cheesecake-factory-ciudad-de-m%C3%A9xico-2?adjust_creative=xDKeFNUg3YH3P2W3fl1X6g&hrid=NbEE3MfzRASA-J_4PCNMHw&utm_campaign=yelp_api_v3&utm_medium=api_v3_business_reviews&utm_source=xDKeFNUg3YH3P2W3fl1X6g
kAgr17JFGiWe4wyUy65_tA,BOovv441xPVGCN1amBWBiA,5.0,"{'id': 'Frq2eSf46oqIDcDU5gD6bA', 'profile_url': 'https://www.yelp.com/user_details?userid=Frq2eSf46oqIDcDU5gD6bA', 'image_url': None, 'name': 'Lunadi N.'}","Muy bueno, generalmente es para llevar. Mi favorito el hot dog cuarto de libra, riquísimo; y ni se digan las papas de gajos, ensaladas y malteadas.",2016-08-14 17:49:38,https://www.yelp.com/biz/terraza-fries-m%C3%A9xico?adjust_creative=xDKeFNUg3YH3P2W3fl1X6g&hrid=kAgr17JFGiWe4wyUy65_tA&utm_campaign=yelp_api_v3&utm_medium=api_v3_business_reviews&utm_source=xDKeFNUg3YH3P2W3fl1X6g
qIQXh20Gm4kxy3nwugW5bA,dq8VrgklqtcTIxi1nYGKjg,3.0,"{'id': 'DCy05VQh97F0ceCvfDQLvg', 'profile_url': 'https://www.yelp.com/user_details?userid=DCy05VQh97F0ceCvfDQLvg', 'image_url': 'https://s3-media2.fl.yelpcdn.com/photo/ybNIS2dgPS7ECyFreUPOSA/o.jpg', 'name': 'Pablo M.'}",Este puesto de hamburguesas al carbón es el segundo en su especie: la devoción a las motocicletas Harley Davidson la llevan al límite de apropiarse de su...,2014-02-09 21:19:11,https://www.yelp.com/biz/club-potros-ii-m%C3%A9xico?adjust_creative=xDKeFNUg3YH3P2W3fl1X6g&hrid=qIQXh20Gm4kxy3nwugW5bA&utm_campaign=yelp_api_v3&utm_medium=api_v3_business_reviews&utm_source=xDKeFNUg3YH3P2W3fl1X6g
Prpq4lfxlYc2_2KYi-ezhA,2FGzPVd2hsXT6ohPD4XxcQ,3.0,"{'id': '_5Oem1iAW7KBYOCmGPocTQ', 'profile_url': 'https://www.yelp.com/user_details?userid=_5Oem1iAW7KBYOCmGPocTQ', 'image_url': 'https://s3-media3.fl.yelpcdn.com/photo/offglRBBVOcfQEkzBLy0dw/o.jpg', 'name': 'Alfonso R.'}","En este pequeño negocio no sólo se venden hamburguesas, sino que también hay hot dogs, banderillas, papas a la francesa, plátanos fritos, sopes y flautas....",2014-02-27 18:32:39,https://www.yelp.com/biz/tragaldabas-m%C3%A9xico?adjust_creative=xDKeFNUg3YH3P2W3fl1X6g&hrid=Prpq4lfxlYc2_2KYi-ezhA&utm_campaign=yelp_api_v3&utm_medium=api_v3_business_reviews&utm_source=xDKeFNUg3YH3P2W3fl1X6g
W9cO_iTg6pCaBHSAC78LdA,m2l2HK2MbDrDNlrPbJJXqA,4.0,"{'id': 'NYfCHIX_5NDWEbkYOxrfRg', 'profile_url': 'https://www.yelp.com/user_details?userid=NYfCHIX_5NDWEbkYOxrfRg', 'image_url': 'https://s3-media2.fl.yelpcdn.com/photo/RGLa0zsz8w5khDa4UIPyig/o.jpg', 'name': 'Rossy R.'}","Es un lugar sencillo en vertiz, sobresale porque vende hamburguesas en una calle repleta de taquerias, vaya creo que es original. Las hamburguesas hawaianas...",2016-03-11 00:31:08,https://www.yelp.com/biz/emilios-m%C3%A9xico?adjust_creative=xDKeFNUg3YH3P2W3fl1X6g&hrid=W9cO_iTg6pCaBHSAC78LdA&utm_campaign=yelp_api_v3&utm_medium=api_v3_business_reviews&utm_source=xDKeFNUg3YH3P2W3fl1X6g
uQZZbrI9qBWKYQ5ANcRIOA,m2l2HK2MbDrDNlrPbJJXqA,3.0,"{'id': 'DCy05VQh97F0ceCvfDQLvg', 'profile_url': 'https://www.yelp.com/user_details?userid=DCy05VQh97F0ceCvfDQLvg', 'image_url': 'https://s3-media2.fl.yelpcdn.com/photo/ybNIS2dgPS7ECyFreUPOSA/o.jpg', 'name': 'Pablo M.'}",Este negocio nació en el patio de una casa muy particular. Su ubicación es estratégica: Avenida Universidad entre Petén y Torres Adalid. La enorme oferta de...,2014-01-31 11:31:35,https://www.yelp.com/biz/emilios-m%C3%A9xico?adjust_creative=xDKeFNUg3YH3P2W3fl1X6g&hrid=uQZZbrI9qBWKYQ5ANcRIOA&utm_campaign=yelp_api_v3&utm_medium=api_v3_business_reviews&utm_source=xDKeFNUg3YH3P2W3fl1X6g
YOd7gPSooVH5kAbkl0HMJg,m2l2HK2MbDrDNlrPbJJXqA,3.0,"{'id': 'Q5IwVS4KqNg949se7lqf5g', 'profile_url': 'https://www.yelp.com/user_details?userid=Q5IwVS4KqNg949se7lqf5g', 'image_url': 'https://s3-media2.fl.yelpcdn.com/photo/74G0zDl5UiWnLQ1vWoahFg/o.jpg', 'name': 'María Laura G.'}","Hamburguesas Emilio´s se encuentra ubicada en una casa de Avenida Universidad en la colonia Narvarte y ofrece unas hamburguesas muy buenas, sustanciosas y a...",2013-12-29 22:17:54,https://www.yelp.com/biz/emilios-m%C3%A9xico?adjust_creative=xDKeFNUg3YH3P2W3fl1X6g&hrid=YOd7gPSooVH5kAbkl0HMJg&utm_campaign=yelp_api_v3&utm_medium=api_v3_business_reviews&utm_source=xDKeFNUg3YH3P2W3fl1X6g
Av1L9U6_2ZPgA8Z760gyrg,VM4V57Cqb4XTAT591YtjSA,1.0,"{'id': 't4Xd6OzdAovfQ_A_4f3Rkg', 'profile_url': 'https://www.yelp.com/user_details?userid=t4Xd6OzdAovfQ_A_4f3Rkg', 'image_url': 'https://s3-media3.fl.yelpcdn.com/photo/Ss2Klzs4w_vb3hwSHYFx6w/o.jpg', 'name': 'Gina L.'}","Me salió un gusano en la hamburguesa y me dieron un Boing caduco. Además de esto me dieron la cuenta mal, me cobraban más de lo que pedí. No hubo ni...",2016-12-30 13:51:33,https://www.yelp.com/biz/burguers-ink-m%C3%A9xico?adjust_creative=xDKeFNUg3YH3P2W3fl1X6g&hrid=Av1L9U6_2ZPgA8Z760gyrg&utm_campaign=yelp_api_v3&utm_medium=api_v3_business_reviews&utm_source=xDKeFNUg3YH3P2W3fl1X6g
uw1c4bryIO-hkb9H3cyhZw,lOmIPy8sS7fjnaX4P_bqng,3.0,"{'id': 'tYoW0VMvNx--TbsM4MNgJw', 'profile_url': 'https://www.yelp.com/user_details?userid=tYoW0VMvNx--TbsM4MNgJw', 'image_url': 'https://s3-media3.fl.yelpcdn.com/photo/PUvhoZw7j1hc8cPk0pw_Dg/o.jpg', 'name': 'Eduardo R.'}","Este negocio que se pone cada vez que quiere, y lo digo así tal cual porque para mi mala suerte, siempre que requiero ir a comprar ahí no están, y cuando no...",2014-01-28 07:51:52,https://www.yelp.com/biz/las-del-parque-de-la-moderna-m%C3%A9xico?adjust_creative=xDKeFNUg3YH3P2W3fl1X6g&hrid=uw1c4bryIO-hkb9H3cyhZw&utm_campaign=yelp_api_v3&utm_medium=api_v3_business_reviews&utm_source=xDKeFNUg3YH3P2W3fl1X6g
pxOpy8a7pAuDkTwzHoKE_g,lOmIPy8sS7fjnaX4P_bqng,4.0,"{'id': 'ET-GalsBo0-z-QQSRlE4DA', 'profile_url': 'https://www.yelp.com/user_details?userid=ET-GalsBo0-z-QQSRlE4DA', 'image_url': 'https://s3-media3.fl.yelpcdn.com/photo/WPmTbA5NZTPF5YB8gKaZrA/o.jpg', 'name': 'Alvaro Ernesto O.'}","Un puesto callejero muy completo, hamburguesas, hot dogs, banderilla, alitas, palomitas de pollo, postres y hasta productos por catalogo que vende la...",2014-01-19 22:39:55,https://www.yelp.com/biz/las-del-parque-de-la-moderna-m%C3%A9xico?adjust_creative=xDKeFNUg3YH3P2W3fl1X6g&hrid=pxOpy8a7pAuDkTwzHoKE_g&utm_campaign=yelp_api_v3&utm_medium=api_v3_business_reviews&utm_source=xDKeFNUg3YH3P2W3fl1X6g
fl5vNshlGSlEM4fPZShg9w,x-mmNWzKxLRfz6L27sBxSw,3.0,"{'id': 'qZBcwrnYI5vZyWcDGqFReQ', 'profile_url': 'https://www.yelp.com/user_details?userid=qZBcwrnYI5vZyWcDGqFReQ', 'image_url': 'https://s3-media3.fl.yelpcdn.com/photo/l0vNrgOH92SJjI-GaLeinw/o.jpg', 'name': 'Iván C.'}","Este lugar es un poco inesperado por su decoración, organización y eficiencia; en un pequeño local, con estructuras de madera que le da un estilo casi...",2014-01-11 10:57:30,https://www.yelp.com/biz/la-papa-crepera-m%C3%A9xico?adjust_creative=xDKeFNUg3YH3P2W3fl1X6g&hrid=fl5vNshlGSlEM4fPZShg9w&utm_campaign=yelp_api_v3&utm_medium=api_v3_business_reviews&utm_source=xDKeFNUg3YH3P2W3fl1X6g
T1OJk4tMZvY3nc2UKPDxvA,x-mmNWzKxLRfz6L27sBxSw,3.0,"{'id': 'InZWvvl8d5V8NSt7uSPwWQ', 'profile_url': 'https://www.yelp.com/user_details?userid=InZWvvl8d5V8NSt7uSPwWQ', 'image_url': 'https://s3-media3.fl.yelpcdn.com/photo/HFYAaOzUsbdKy7_gIOsByw/o.jpg', 'name': 'Fernanda R.'}","Lugar muy pequeñito pero con buena variedad de alimentos, las hamburguesas, papas a la francesa, elotes y esquites son buenos, lo peor del lugar son las...",2014-10-16 20:39:08,https://www.yelp.com/biz/la-papa-crepera-m%C3%A9xico?adjust_creative=xDKeFNUg3YH3P2W3fl1X6g&hrid=T1OJk4tMZvY3nc2UKPDxvA&utm_campaign=yelp_api_v3&utm_medium=api_v3_business_reviews&utm_source=xDKeFNUg3YH3P2W3fl1X6g
p_TLi6JR9jLYrnijv_-3VQ,aSGy2dT90taZ92-Coo8eeQ,3.0,"{'id': 'InZWvvl8d5V8NSt7uSPwWQ', 'profile_url': 'https://www.yelp.com/user_details?userid=InZWvvl8d5V8NSt7uSPwWQ', 'image_url': 'https://s3-media3.fl.yelpcdn.com/photo/HFYAaOzUsbdKy7_gIOsByw/o.jpg', 'name': 'Fernanda R.'}","Chiquito, cálido, no muy fashion pero sí muy a gusto para pasar el rato.

Buenos precios, las alitas son geniales porque no son fritas, las preparan a las...",2014-10-17 20:03:19,https://www.yelp.com/biz/universitarios-m%C3%A9xico?adjust_creative=xDKeFNUg3YH3P2W3fl1X6g&hrid=p_TLi6JR9jLYrnijv_-3VQ&utm_campaign=yelp_api_v3&utm_medium=api_v3_business_reviews&utm_source=xDKeFNUg3YH3P2W3fl1X6g
cDgqCPsc1b__kUXWJOBbxg,zzatKsMi2wPLjZosCi619A,4.0,"{'id': 'DCy05VQh97F0ceCvfDQLvg', 'profile_url': 'https://www.yelp.com/user_details?userid=DCy05VQh97F0ceCvfDQLvg', 'image_url': 'https://s3-media2.fl.yelpcdn.com/photo/ybNIS2dgPS7ECyFreUPOSA/o.jpg', 'name': 'Pablo M.'}","Antes de que se instalaran locales de pizzas exitosos, antes incluso de que hubiera un boom de restaurantes argentinos. Antes de que la colonia se llenara...",2014-02-13 20:21:36,https://www.yelp.com/biz/pepes-burger-snacks-ciudad-de-m%C3%A9xico?adjust_creative=xDKeFNUg3YH3P2W3fl1X6g&hrid=cDgqCPsc1b__kUXWJOBbxg&utm_campaign=yelp_api_v3&utm_medium=api_v3_business_reviews&utm_source=xDKeFNUg3YH3P2W3fl1X6g
-bZFAIFn40J1QglJ98IWVA,zzatKsMi2wPLjZosCi619A,4.0,"{'id': 'N9rsbwKOlpYTiFpGtGYMSw', 'profile_url': 'https://www.yelp.com/user_details?userid=N9rsbwKOlpYTiFpGtGYMSw', 'image_url': 'https://s3-media1.fl.yelpcdn.com/photo/EkM0ss7NpmgWChTWby2lbQ/o.jpg', 'name': 'Adriana E.'}","Bajo un edificio rosa de muchas ventanas está la enorme barra que rodea estas hamburguesas al carbón, famosas en la colonia Narvarte. Tienen una gran...",2014-01-16 15:25:35,https://www.yelp.com/biz/pepes-burger-snacks-ciudad-de-m%C3%A9xico?adjust_creative=xDKeFNUg3YH3P2W3fl1X6g&hrid=-bZFAIFn40J1QglJ98IWVA&utm_campaign=yelp_api_v3&utm_medium=api_v3_business_reviews&utm_source=xDKeFNUg3YH3P2W3fl1X6g
vuxld0cwgGGzwnCJtQ4wIQ,zzatKsMi2wPLjZosCi619A,3.0,"{'id': 'lY7oEmqNftC-LwimQs-ZPQ', 'profile_url': 'https://www.yelp.com/user_details?userid=lY7oEmqNftC-LwimQs-ZPQ', 'image_url': 'https://s3-media2.fl.yelpcdn.com/photo/Yw9Q2Opn-Ob4uWhaJPtqSg/o.jpg', 'name': 'Alaíde V.'}","Sobresalen en la zona. Ofrecen hamburguesas grandes a precios no tan altos. Además, sus variedades no son las de siempre (res o doble res), sino que tienen...",2014-01-09 10:00:17,https://www.yelp.com/biz/pepes-burger-snacks-ciudad-de-m%C3%A9xico?adjust_creative=xDKeFNUg3YH3P2W3fl1X6g&hrid=vuxld0cwgGGzwnCJtQ4wIQ&utm_campaign=yelp_api_v3&utm_medium=api_v3_business_reviews&utm_source=xDKeFNUg3YH3P2W3fl1X6g
XAGY-9EMKKaNjCMZpIeI6g,4HmkZctrfEx0AQsEguaVWA,3.0,"{'id': 'R_c6CwXNzLApd2jFWIltXA', 'profile_url': 'https://www.yelp.com/user_details?userid=R_c6CwXNzLApd2jFWIltXA', 'image_url': 'https://s3-media3.fl.yelpcdn.com/photo/ZNjAEJKggwaH3SKEAJ9wAA/o.jpg', 'name': 'Raúl A.'}","Seguido las veía cuando pasaba por la tarde-noche en el micro rumbo a mi casa. Pasaba y las veía desde la ventana, y me llegaba el olor del carbón, el olor...",2014-01-24 09:08:49,https://www.yelp.com/biz/gourmet-narvarte?adjust_creative=xDKeFNUg3YH3P2W3fl1X6g&hrid=XAGY-9EMKKaNjCMZpIeI6g&utm_campaign=yelp_api_v3&utm_medium=api_v3_business_reviews&utm_source=xDKeFNUg3YH3P2W3fl1X6g
Xm1BUN87IV0TjS4BR-avMQ,4HmkZctrfEx0AQsEguaVWA,3.0,"{'id': 'Q5IwVS4KqNg949se7lqf5g', 'profile_url': 'https://www.yelp.com/user_details?userid=Q5IwVS4KqNg949se7lqf5g', 'image_url': 'https://s3-media2.fl.yelpcdn.com/photo/74G0zDl5UiWnLQ1vWoahFg/o.jpg', 'name': 'María Laura G.'}","Sobre la calle Cumbres de Maltrata, justo enfrente de la iglesia del Sagrado corazón en la colonia Narvarte hay un puesto de lámina de hamburguesas llamado...",2013-12-20 11:29:17,https://www.yelp.com/biz/gourmet-narvarte?adjust_creative=xDKeFNUg3YH3P2W3fl1X6g&hrid=Xm1BUN87IV0TjS4BR-avMQ&utm_campaign=yelp_api_v3&utm_medium=api_v3_business_reviews&utm_source=xDKeFNUg3YH3P2W3fl1X6g
WgSMwITCxBRmDLdtQNcgOw,vDVqQum7xE72GXkZlf7Xvg,4.0,"{'id': 'zp4Q73nruT-A5EBmGDWiiw', 'profile_url': 'https://www.yelp.com/user_details?userid=zp4Q73nruT-A5EBmGDWiiw', 'image_url': 'https://s3-media2.fl.yelpcdn.com/photo/Gwy54lINC8n09zNUr-zcSw/o.jpg', 'name': 'Alberto F.'}","Lugar legendario de hamburguesas al carbón en la Narvarte, la especialidad es la la hamburguesa con queso Oaxaca",2014-08-01 20:27:11,https://www.yelp.com/biz/la-morena-m%C3%A9xico-2?adjust_creative=xDKeFNUg3YH3P2W3fl1X6g&hrid=WgSMwITCxBRmDLdtQNcgOw&utm_campaign=yelp_api_v3&utm_medium=api_v3_business_reviews&utm_source=xDKeFNUg3YH3P2W3fl1X6g
QFpi_hKG6BclEZwfFKJmWQ,dMRqwTdfRmdUS3kLyreufw,3.0,"{'id': 'ol__6_S64_kYFPZDZOmN_w', 'profile_url': 'https://www.yelp.com/user_details?userid=ol__6_S64_kYFPZDZOmN_w', 'image_url': 'https://s3-media2.fl.yelpcdn.com/photo/LzkkafKzN8n1ClxLpS71Yg/o.jpg', 'name': 'Guillermo Y.'}","Hace poco caminaba por ahí y tuve que parar a probar sus tacos luego de ver la cantidad de gente que tenían. Se iban unos pero llegaban otros, así que nunca...",2014-01-19 11:19:42,https://www.yelp.com/biz/tacos-tony-m%C3%A9xico?adjust_creative=xDKeFNUg3YH3P2W3fl1X6g&hrid=QFpi_hKG6BclEZwfFKJmWQ&utm_campaign=yelp_api_v3&utm_medium=api_v3_business_reviews&utm_source=xDKeFNUg3YH3P2W3fl1X6g
CAjXDAXNpeRuincsVEbLOQ,dMRqwTdfRmdUS3kLyreufw,3.0,"{'id': 'DCy05VQh97F0ceCvfDQLvg', 'profile_url': 'https://www.yelp.com/user_details?userid=DCy05VQh97F0ceCvfDQLvg', 'image_url': 'https://s3-media2.fl.yelpcdn.com/photo/ybNIS2dgPS7ECyFreUPOSA/o.jpg', 'name': 'Pablo M.'}","Como antiguos exploradores en un océano indómito, Tacos Tony reclamó posesión de un triangulito de banqueta que forman las calles Torres Adalid, Petén y la...",2014-01-30 14:27:00,https://www.yelp.com/biz/tacos-tony-m%C3%A9xico?adjust_creative=xDKeFNUg3YH3P2W3fl1X6g&hrid=CAjXDAXNpeRuincsVEbLOQ&utm_campaign=yelp_api_v3&utm_medium=api_v3_business_reviews&utm_source=xDKeFNUg3YH3P2W3fl1X6g
gUkym55diUtUvjJMZaTfcw,dMRqwTdfRmdUS3kLyreufw,3.0,"{'id': 'tGsul1q0SvW0rq3uwiInFw', 'profile_url': 'https://www.yelp.com/user_details?userid=tGsul1q0SvW0rq3uwiInFw', 'image_url': 'https://s3-media2.fl.yelpcdn.com/photo/ChtNdhpTP5LaaBY670dphA/o.jpg', 'name': 'Nayeli A.'}","Tenemos opiniones divididas, a mi me gustan los tacos, cada que pasaba por esta avenida los veía y siempre pensaban que un día me detendría a comerlos y así...",2014-01-21 21:12:03,https://www.yelp.com/biz/tacos-tony-m%C3%A9xico?adjust_creative=xDKeFNUg3YH3P2W3fl1X6g&hrid=gUkym55diUtUvjJMZaTfcw&utm_campaign=yelp_api_v3&utm_medium=api_v3_business_reviews&utm_source=xDKeFNUg3YH3P2W3fl1X6g
